{
  "schemaVersion": "1.0.0",
  "catalogVersion": "reference-profile-catalog-1.0.0",
  "profileModelVersion": "reference-profile-model-1.0.0",
  "sourceLedgerVersion": "reference-profile-sources-1.0.0",
  "origin": "independent_authoring",
  "modelVersion": "generic-1.16.0-pilot",
  "routePolicyVersion": "progressive-depth-2.7.0",
  "publicationStatus": "internal_only",
  "scopeNote": "These are narrow, source-traceable comparisons of selected commitments. They do not classify a respondent or reconstruct a whole philosopher or tradition.",
  "sources": [
    {
      "id": "primary-peirce-how-to-make-ideas-clear",
      "sourceType": "primary_text",
      "authors": ["Charles Sanders Peirce"],
      "title": "How to Make Our Ideas Clear",
      "container": "Popular Science Monthly, volume 12",
      "year": 1878,
      "url": "https://www.peirce.org/writings/p119.html",
      "accessNote": "Online transcription of Peirce's original essay; the Stanford Encyclopedia entry is used for scholarly context."
    },
    {
      "id": "primary-peirce-fallibilism-continuity-evolution",
      "sourceType": "primary_text",
      "authors": ["Charles Sanders Peirce"],
      "title": "Fallibilism, Continuity, and Evolution",
      "container": "Collected Papers of Charles Sanders Peirce, volume 1, sections 1.141–1.175",
      "year": 1897,
      "url": "https://www.textlog.de/4248.html",
      "accessNote": "Online text transcription of the posthumously published paper; citation follows the Collected Papers section numbering."
    },
    {
      "id": "primary-wolff-in-defense-of-anarchism",
      "sourceType": "primary_text",
      "authors": ["Robert Paul Wolff"],
      "title": "In Defense of Anarchism",
      "year": 1970,
      "url": "https://theanarchistlibrary.org/library/robert-paul-wolff-in-defense-of-anarchism",
      "accessNote": "Digital transcription of the book; used only for Wolff's stated argument, not as a canonical account of every philosophical-anarchist position."
    },
    {
      "id": "primary-locke-essay-book-iv",
      "sourceType": "primary_text",
      "authors": ["John Locke"],
      "title": "An Essay Concerning Human Understanding, Book IV",
      "year": 1690,
      "url": "https://www.earlymoderntexts.com/assets/pdfs/locke1690book4.pdf",
      "accessNote": "Modernized text edition of Locke's work; cited to the book and section numbering, with the SEP entry providing interpretive context."
    }
  ],
  "profiles": [
    {
      "schemaVersion": "1.1.0",
      "profileVersion": "reference-profile-1.0.0",
      "modelVersion": "generic-1.16.0-pilot",
      "routePolicyVersion": "progressive-depth-2.7.0",
      "id": "philosophical-anarchism-general-obligation-scoped",
      "label": "Philosophical anarchism — general content-independent obedience criterion (scoped)",
      "entityType": "tradition",
      "origin": "independent_authoring",
      "coverageStatus": "partial",
      "publicationStatus": "internal_only",
      "scope": "One comparison criterion: whether there is a general moral duty to obey law merely because it is law. This does not reconstruct philosophical anarchism as a whole.",
      "identityOutputAllowed": false,
      "percentageMatchAllowed": false,
      "neighbors": [
        "A posteriori philosophical anarchism",
        "Consent-based accounts of political obligation",
        "Content-independent authority",
        "Prudential or moral reasons to comply without a general duty"
      ],
      "nonEntailments": [
        "Immediate abolition of the state",
        "Rejection of voting, courts, or all institutions",
        "Violence, resistance, or refusal to comply in every case",
        "The claim that no law can create any moral reason for action",
        "Moral skepticism"
      ],
      "unmeasuredAreas": [
        "The full range of arguments for and against political obligation",
        "Institutional alternatives, transition, and the practical feasibility of anarchist arrangements",
        "Whether democracy, consent, fairness, or consequences can ground particular obligations"
      ],
      "claims": [
        {
          "id": "general-content-independent-obligation",
          "propositionId": "legacy-philosophical-anarchism-no-general-obedience",
          "targetKind": "scope",
          "targetText": "The philosophical-anarchist position about a general content-independent duty to obey, not a policy of immediate institutional abolition.",
          "expectedState": "supported",
          "importance": "core",
          "evidenceBasis": "primary_text",
          "mappingStatus": "DIRECT",
          "routeAvailability": ["quick", "standard", "full"],
          "publicUse": "comparison",
          "sourceClaims": [
            {
              "sourceId": "primary-wolff-in-defense-of-anarchism",
              "relationship": "supports_profile_claim",
              "locator": "Chapter I, section 3, conclusion on autonomy and a duty to obey laws simply because they are laws.",
              "claim": "Wolff's argument denies that citizens have a general duty to obey state laws solely because they are laws; this is one argument within philosophical anarchism."
            },
            {
              "sourceId": "acad-obligation",
              "relationship": "supports_profile_claim",
              "locator": "Section 3.2, 'Against Philosophical Anarchism.'",
              "claim": "The scholarly overview treats philosophical-anarchist arguments as challenges to a general obligation to obey law and distinguishes variants of those arguments."
            }
          ],
          "neighbors": ["Consent theory", "Fair-play accounts", "Anarchism as a political program"],
          "nonEntailments": ["State abolition", "A specific institutional replacement", "Violent methods", "No reason to comply with any law"],
          "limitations": [
            "The active WVS target is a narrowly scoped comparison rule; it does not settle competing arguments or internal variants.",
            "PLI048 and the other mapped items concern the stated obligation criterion, not every reason for compliance."
          ]
        }
      ],
      "limitations": [
        "This is a single-criterion comparison, not a complete philosophical-anarchist profile.",
        "Do not infer abolition, institutional rejection, tactics, or general noncompliance from this result."
      ]
    },
    {
      "schemaVersion": "1.1.0",
      "profileVersion": "reference-profile-1.0.0",
      "modelVersion": "generic-1.16.0-pilot",
      "routePolicyVersion": "progressive-depth-2.7.0",
      "id": "pragmatism-pragmatic-maxim-scoped",
      "label": "Pragmatism — pragmatic-maxim criterion (scoped)",
      "entityType": "tradition",
      "origin": "independent_authoring",
      "coverageStatus": "partial",
      "publicationStatus": "internal_only",
      "scope": "The pragmatic maxim as a method for clarifying concepts and apparent disputes through conceivable practical or experiential bearings; not a complete account of pragmatism.",
      "identityOutputAllowed": false,
      "percentageMatchAllowed": false,
      "neighbors": [
        "Generic fallibilism",
        "Scientific empiricism",
        "Instrumentalism",
        "Logical verificationism",
        "Consequences as one useful clarification technique"
      ],
      "nonEntailments": [
        "A belief is true merely because it is useful",
        "A complete pragmatist theory of truth",
        "Rejection of mind-independent reality",
        "Reduction of all meaningful claims to observation",
        "A political or religious position"
      ],
      "unmeasuredAreas": [
        "Pragmatist theories of truth and realism",
        "The roles of inquiry, community, habit, and experimental practice across pragmatist traditions",
        "Differences among Peirce, James, Dewey, and later pragmatists"
      ],
      "claims": [
        {
          "id": "pragmatic-maxim",
          "propositionId": "construct-EP16",
          "targetKind": "proposition",
          "targetText": "Disputed ideas should be clarified through their conceivable effects on experience or conduct; if two formulations have no conceivable difference in those effects, their apparent conceptual difference is not substantive.",
          "expectedState": "supported",
          "importance": "core",
          "evidenceBasis": "primary_text",
          "mappingStatus": "ROUTE_LIMITED",
          "routeAvailability": ["full"],
          "publicUse": "comparison",
          "sourceClaims": [
            {
              "sourceId": "primary-peirce-how-to-make-ideas-clear",
              "relationship": "supports_profile_claim",
              "locator": "Part II, Peirce's statement and explanation of the pragmatic maxim.",
              "claim": "Peirce's maxim clarifies a conception by considering the conceivable practical bearings of its object."
            },
            {
              "sourceId": "acad-pragmatism",
              "relationship": "supports_profile_claim",
              "locator": "Sections 2 and 2.1; compare sections 3.1 and 3.2 for variation about truth.",
              "claim": "The scholarly account presents Peirce's maxim as a method for clarifying hypotheses through experience while documenting disagreement among pragmatists about truth and reality."
            }
          ],
          "neighbors": ["Fallibilism", "Empiricism", "Instrumentalism", "Verificationism"],
          "nonEntailments": ["Truth is whatever works", "Antirealism", "Scientific method as a complete philosophy"],
          "limitations": [
            "Only the stated clarification criterion is represented; the full tradition is not.",
            "The active item set does not distinguish all pragmatist accounts of truth, realism, or inquiry."
          ]
        }
      ],
      "limitations": [